{
  "$schema": "http://json-schema.org/draft-07/schema#",
  "title": "Bar",
  "description": "A bar in the BarFindr application",
  "type": "object",
  "required": [
    "id",
    "name",
    "slug",
    "address",
    "description",
    "rating",
    "imageUrl",
    "hasHappyHour",
    "openingHours",
    "tags",
    "location"
  ],
  "properties": {
    "id": {
      "type": "string",
      "description": "Unique identifier for the bar"
    },
    "name": {
      "type": "string",
      "description": "Name of the bar"
    },
    "slug": {
      "type": "string",
      "description": "URL-friendly version of the name",
      "pattern": "^[a-z0-9]+(?:-[a-z0-9]+)*$"
    },
    "address": {
      "type": "string",
      "description": "Full address of the bar"
    },
    "description": {
      "type": "string",
      "description": "Brief description of the bar"
    },
    "rating": {
      "type": "number",
      "minimum": 0,
      "maximum": 5,
      "description": "Overall/average rating from 0.0 to 5.0"
    },
    "ratings": {
      "type": "object",
      "description": "Ratings from different sources",
      "properties": {
        "google": {
          "type": "number",
          "minimum": 0,
          "maximum": 5,
          "description": "Google rating from 0.0 to 5.0"
        },
        "yelp": {
          "type": "number",
          "minimum": 0,
          "maximum": 5,
          "description": "Yelp rating from 0.0 to 5.0"
        },
        "internal": {
          "type": "number",
          "minimum": 0,
          "maximum": 5,
          "description": "Internal/user rating from 0.0 to 5.0"
        }
      }
    },
    "imageUrl": {
      "type": "string",
      "format": "uri",
      "description": "URL to the bar's image"
    },
    "hasHappyHour": {
      "type": "boolean",
      "description": "Whether the bar has a happy hour"
    },
    "happyHourDetails": {
      "type": "string",
      "description": "Details about the happy hour (if applicable)"
    },
    "openingHours": {
      "type": "object",
      "description": "Opening hours for each day of the week",
      "required": [
        "Monday",
        "Tuesday",
        "Wednesday",
        "Thursday",
        "Friday",
        "Saturday",
        "Sunday"
      ],
      "properties": {
        "Monday": {
          "type": "string",
          "description": "Opening hours for Monday"
        },
        "Tuesday": {
          "type": "string",
          "description": "Opening hours for Tuesday"
        },
        "Wednesday": {
          "type": "string",
          "description": "Opening hours for Wednesday"
        },
        "Thursday": {
          "type": "string",
          "description": "Opening hours for Thursday"
        },
        "Friday": {
          "type": "string",
          "description": "Opening hours for Friday"
        },
        "Saturday": {
          "type": "string",
          "description": "Opening hours for Saturday"
        },
        "Sunday": {
          "type": "string",
          "description": "Opening hours for Sunday"
        }
      }
    },
    "tags": {
      "type": "array",
      "description": "Array of tags for filtering",
      "items": {
        "type": "string"
      },
      "minItems": 1
    },
    "location": {
      "type": "object",
      "description": "Geographic coordinates for the map",
      "required": [
        "lat",
        "lng"
      ],
      "properties": {
        "lat": {
          "type": "number",
          "description": "Latitude"
        },
        "lng": {
          "type": "number",
          "description": "Longitude"
        }
      }
    },
    "type": {
      "type": "string",
      "description": "Type of bar (e.g., dive bar, wine bar)"
    },
    "priceRange": {
      "type": "number",
      "description": "Price range (1-4, where 1 is cheap and 4 is expensive)",
      "minimum": 1,
      "maximum": 4
    },
    "neighborhood": {
      "type": "string",
      "description": "Neighborhood (e.g., downtown, east austin)"
    },
    "features": {
      "type": "array",
      "description": "Special features (e.g., patio, rooftop)",
      "items": {
        "type": "string"
      }
    },
    "zipCode": {
      "type": "string",
      "description": "ZIP code for more precise location filtering",
      "pattern": "^\\d{5}(-\\d{4})?$"
    }
  },
  "dependencies": {
    "hasHappyHour": {
      "oneOf": [
        {
          "properties": {
            "hasHappyHour": {
              "enum": [false]
            }
          }
        },
        {
          "properties": {
            "hasHappyHour": {
              "enum": [true]
            },
            "happyHourDetails": {
              "type": "string"
            }
          },
          "required": ["happyHourDetails"]
        }
      ]
    }
  }
}
