{
  "id": "",
  "name": "",
  "slug": "",
  "address": "",
  "description": "",
  "rating": 0.0,
  "ratings": {
    "google": 0.0,
    "yelp": 0.0,
    "internal": 0.0
  },
  "imageUrl": "",
  "hasHappyHour": false,
  "happyHourDetails": "",
  "openingHours": {
    "Monday": "",
    "Tuesday": "",
    "Wednesday": "",
    "Thursday": "",
    "Friday": "",
    "Saturday": "",
    "Sunday": ""
  },
  "tags": [],
  "location": {
    "lat": 0,
    "lng": 0
  },
  "type": "",
  "priceRange": 2,
  "neighborhood": "",
  "features": [],
  "zipCode": ""
}
